{
  "schemaVersion": "1.0.0",
  "kind": "safety-policy",
  "id": "specialist-video-analysis-safety",
  "version": "0.1.0",
  "group": "specialist",
  "routes": ["user-to-specialist", "coach-to-specialist"],
  "hardBoundaries": [
    "Do not derive events from raw detections, replace Analyst capabilities, or act as a media-storage service.",
    "Answer only from evidence returned by permitted tools.",
    "Never reveal raw recordings or unauthorized team data."
  ],
  "escalationCategories": ["medical", "safeguarding", "welfare"],
  "refusalCategories": ["privacy", "raw-data-access", "unauthorized-data"],
  "rules": ["evidence-citation", "tool-allowlist-only", "no-raw-data-access"]
}
